title,url,domain,estimated_domain_authority
"Wink Video v3.6.1 MOD APK (Premium, VIP Unlocked)",https://9mod.com/wink-video.html,9mod.com,44
Wink MOD APK V3.5.0 (VIP Unlocked/No Watermark/Premium) - GETMODSAPK,https://www.getmodsapk.cc/wink-mod-apk/,www.getmodsapk.cc,33
Wink MOD APK v2.21.5 VIP Unlocked (Premium) Latest Version - Wink MOD,https://winkmod.in/,winkmod.in,39
Download Wink Mod APK v2.27.0 (2026) VIP Premium & Unlocked,https://winkmods.com/,winkmods.com,36
"Wink Premium v3.6.1 MOD APK [Full Premium, VIP Unlocked] for Android",https://getmodsapk.com/wink-video-enhancing-tool-mod-apk/,getmodsapk.com,33
Wink MOD APK V2.2.2 Download | Free VIP Unlocked 2025,https://winkapp.com.in/,winkapp.com.in,27
Download Wink: Video Enhancer & Editor 3.5.5 APK for Android - Free and ...,https://apkpure.net/wink-video-retouching-tool-app/com.meitu.wink/download,apkpure.net,30
Download Wink Mod APK V3.1.0 [Premium+VIP Unlocked]2026,https://modwinkapk.com/,modwinkapk.com,29
Wink Mod APK v2.1.5 Download Unlimited Exports | VIP Unlocked - Wink,https://wink.pk/,wink.pk,32
Wink Mod APK v2.19.1Download [Pro + VIP Unlocked] 2026,https://winksapps.com/,winksapps.com,29
